{
  "$schema": "http://json-schema.org/draft-07/schema#",
  "type": "object",
  "title": "mainMenu Configuration Schema",
  "description": "Auto-generated schema for mainMenu configuration",
  "_generated": "2025-09-27T07:05:06.928Z",
  "_generator": "componentSchemaGenerator v1.0.0",
  "_version": "0.1.0",
  "properties": {
    "component": {
      "type": "object",
      "properties": {
        "name": {
          "type": "string",
          "minLength": 1
        },
        "displayName": {
          "type": "string",
          "minLength": 1
        },
        "type": {
          "type": "string",
          "minLength": 1
        },
        "category": {
          "type": "string",
          "minLength": 1
        }
      },
      "additionalProperties": true
    },
    "ui": {
      "type": "object",
      "properties": {
        "layout": {
          "type": "object",
          "properties": {
            "width": {
              "type": "number",
              "minimum": 0
            },
            "background": {
              "type": "string",
              "pattern": "^#[0-9a-fA-F]{6}$",
              "description": "Hex color code",
              "minLength": 1
            },
            "borderRight": {
              "type": "string",
              "minLength": 1
            },
            "fontSize": {
              "type": "string",
              "minLength": 1
            },
            "padding": {
              "type": "string",
              "minLength": 1
            }
          },
          "additionalProperties": true
        },
        "menuItem": {
          "type": "object",
          "properties": {
            "padding": {
              "type": "string",
              "minLength": 1
            },
            "fontSize": {
              "type": "string",
              "minLength": 1
            },
            "hoverBackground": {
              "type": "string",
              "pattern": "^#[0-9a-fA-F]{6}$",
              "description": "Hex color code",
              "minLength": 1
            },
            "activeBackground": {
              "type": "string",
              "pattern": "^#[0-9a-fA-F]{6}$",
              "description": "Hex color code",
              "minLength": 1
            },
            "activeColor": {
              "type": "string",
              "pattern": "^#[0-9a-fA-F]{6}$",
              "description": "Hex color code",
              "minLength": 1
            },
            "iconSpacing": {
              "type": "string",
              "minLength": 1
            }
          },
          "additionalProperties": true
        },
        "accessibility": {
          "type": "object",
          "properties": {
            "focusVisible": {
              "type": "boolean"
            },
            "keyboardNavigation": {
              "type": "boolean"
            },
            "ariaLabels": {
              "type": "boolean"
            }
          },
          "additionalProperties": true
        }
      },
      "additionalProperties": true
    },
    "roleBasedAccess": {
      "type": "object",
      "properties": {
        "OPERATOR": {
          "type": "object",
          "properties": {
            "menuItems": {
              "type": "number",
              "minimum": 0
            },
            "permissions": {
              "type": "array",
              "items": {
                "type": "string",
                "minLength": 1
              },
              "minItems": 0
            },
            "color": {
              "type": "string",
              "pattern": "^#[0-9a-fA-F]{6}$",
              "description": "Hex color code",
              "minLength": 1
            },
            "allowedRoutes": {
              "type": "array",
              "items": {
                "type": "string",
                "minLength": 1
              },
              "minItems": 0
            }
          },
          "additionalProperties": true
        },
        "ADMIN": {
          "type": "object",
          "properties": {
            "menuItems": {
              "type": "number",
              "minimum": 0
            },
            "permissions": {
              "type": "array",
              "items": {
                "type": "string",
                "minLength": 1
              },
              "minItems": 0
            },
            "color": {
              "type": "string",
              "pattern": "^#[0-9a-fA-F]{6}$",
              "description": "Hex color code",
              "minLength": 1
            },
            "allowedRoutes": {
              "type": "array",
              "items": {
                "type": "string",
                "minLength": 1
              },
              "minItems": 0
            }
          },
          "additionalProperties": true
        },
        "SUPERUSER": {
          "type": "object",
          "properties": {
            "menuItems": {
              "type": "number",
              "minimum": 0
            },
            "permissions": {
              "type": "array",
              "items": {
                "type": "string",
                "minLength": 1
              },
              "minItems": 0
            },
            "color": {
              "type": "string",
              "pattern": "^#[0-9a-fA-F]{6}$",
              "description": "Hex color code",
              "minLength": 1
            },
            "allowedRoutes": {
              "type": "array",
              "items": {
                "type": "string",
                "minLength": 1
              },
              "minItems": 0
            }
          },
          "additionalProperties": true
        },
        "SERWISANT": {
          "type": "object",
          "properties": {
            "menuItems": {
              "type": "number",
              "minimum": 0
            },
            "permissions": {
              "type": "array",
              "items": {
                "type": "string",
                "minLength": 1
              },
              "minItems": 0
            },
            "color": {
              "type": "string",
              "pattern": "^#[0-9a-fA-F]{6}$",
              "description": "Hex color code",
              "minLength": 1
            },
            "allowedRoutes": {
              "type": "array",
              "items": {
                "type": "string",
                "minLength": 1
              },
              "minItems": 0
            }
          },
          "additionalProperties": true
        }
      },
      "additionalProperties": true
    },
    "menuStructure": {
      "type": "object",
      "properties": {
        "dashboard": {
          "type": "object",
          "properties": {
            "label": {
              "type": "string",
              "minLength": 1
            },
            "icon": {
              "type": "string",
              "minLength": 1
            },
            "route": {
              "type": "string",
              "minLength": 1
            },
            "roles": {
              "type": "array",
              "items": {
                "type": "string",
                "minLength": 1
              },
              "minItems": 0
            },
            "order": {
              "type": "number",
              "minimum": 0
            }
          },
          "additionalProperties": true
        },
        "monitoring": {
          "type": "object",
          "properties": {
            "label": {
              "type": "string",
              "minLength": 1
            },
            "icon": {
              "type": "string",
              "minLength": 1
            },
            "route": {
              "type": "string",
              "minLength": 1
            },
            "roles": {
              "type": "array",
              "items": {
                "type": "string",
                "minLength": 1
              },
              "minItems": 0
            },
            "order": {
              "type": "number",
              "minimum": 0
            }
          },
          "additionalProperties": true
        },
        "tests": {
          "type": "object",
          "properties": {
            "label": {
              "type": "string",
              "minLength": 1
            },
            "icon": {
              "type": "string",
              "minLength": 1
            },
            "route": {
              "type": "string",
              "minLength": 1
            },
            "roles": {
              "type": "array",
              "items": {
                "type": "string",
                "minLength": 1
              },
              "minItems": 0
            },
            "order": {
              "type": "number",
              "minimum": 0
            }
          },
          "additionalProperties": true
        },
        "reports": {
          "type": "object",
          "properties": {
            "label": {
              "type": "string",
              "minLength": 1
            },
            "icon": {
              "type": "string",
              "minLength": 1
            },
            "route": {
              "type": "string",
              "minLength": 1
            },
            "roles": {
              "type": "array",
              "items": {
                "type": "string",
                "minLength": 1
              },
              "minItems": 0
            },
            "order": {
              "type": "number",
              "minimum": 0
            }
          },
          "additionalProperties": true
        },
        "users": {
          "type": "object",
          "properties": {
            "label": {
              "type": "string",
              "minLength": 1
            },
            "icon": {
              "type": "string",
              "minLength": 1
            },
            "route": {
              "type": "string",
              "minLength": 1
            },
            "roles": {
              "type": "array",
              "items": {
                "type": "string",
                "minLength": 1
              },
              "minItems": 0
            },
            "order": {
              "type": "number",
              "minimum": 0
            }
          },
          "additionalProperties": true
        },
        "system": {
          "type": "object",
          "properties": {
            "label": {
              "type": "string",
              "minLength": 1
            },
            "icon": {
              "type": "string",
              "minLength": 1
            },
            "route": {
              "type": "string",
              "minLength": 1
            },
            "roles": {
              "type": "array",
              "items": {
                "type": "string",
                "minLength": 1
              },
              "minItems": 0
            },
            "order": {
              "type": "number",
              "minimum": 0
            }
          },
          "additionalProperties": true
        },
        "service": {
          "type": "object",
          "properties": {
            "label": {
              "type": "string",
              "minLength": 1
            },
            "icon": {
              "type": "string",
              "minLength": 1
            },
            "route": {
              "type": "string",
              "minLength": 1
            },
            "roles": {
              "type": "array",
              "items": {
                "type": "string",
                "minLength": 1
              },
              "minItems": 0
            },
            "order": {
              "type": "number",
              "minimum": 0
            }
          },
          "additionalProperties": true
        },
        "calibration": {
          "type": "object",
          "properties": {
            "label": {
              "type": "string",
              "minLength": 1
            },
            "icon": {
              "type": "string",
              "minLength": 1
            },
            "route": {
              "type": "string",
              "minLength": 1
            },
            "roles": {
              "type": "array",
              "items": {
                "type": "string",
                "minLength": 1
              },
              "minItems": 0
            },
            "order": {
              "type": "number",
              "minimum": 0
            }
          },
          "additionalProperties": true
        },
        "diagnostics": {
          "type": "object",
          "properties": {
            "label": {
              "type": "string",
              "minLength": 1
            },
            "icon": {
              "type": "string",
              "minLength": 1
            },
            "route": {
              "type": "string",
              "minLength": 1
            },
            "roles": {
              "type": "array",
              "items": {
                "type": "string",
                "minLength": 1
              },
              "minItems": 0
            },
            "order": {
              "type": "number",
              "minimum": 0
            }
          },
          "additionalProperties": true
        },
        "workshop": {
          "type": "object",
          "properties": {
            "label": {
              "type": "string",
              "minLength": 1
            },
            "icon": {
              "type": "string",
              "minLength": 1
            },
            "route": {
              "type": "string",
              "minLength": 1
            },
            "roles": {
              "type": "array",
              "items": {
                "type": "string",
                "minLength": 1
              },
              "minItems": 0
            },
            "order": {
              "type": "number",
              "minimum": 0
            }
          },
          "additionalProperties": true
        }
      },
      "additionalProperties": true
    },
    "data": {
      "type": "object",
      "properties": {
        "currentUser": {
          "type": "object",
          "properties": {
            "role": {
              "type": "string",
              "enum": [
                "OPERATOR",
                "ADMIN",
                "SUPERUSER",
                "SERWISANT"
              ],
              "minLength": 1
            }
          },
          "additionalProperties": true
        },
        "currentRoute": {
          "type": "string",
          "minLength": 1
        },
        "menuState": {
          "type": "object",
          "properties": {
            "collapsed": {
              "type": "boolean"
            },
            "activeItem": {
              "type": "null"
            }
          },
          "additionalProperties": true
        }
      },
      "additionalProperties": true
    },
    "responsive": {
      "type": "object",
      "properties": {
        "display79": {
          "type": "object",
          "properties": {
            "enabled": {
              "type": "boolean"
            },
            "maxWidth": {
              "type": "string",
              "minLength": 1
            },
            "compactMode": {
              "type": "boolean"
            },
            "collapsible": {
              "type": "boolean"
            }
          },
          "additionalProperties": true
        }
      },
      "additionalProperties": true
    },
    "accessibility": {
      "type": "object",
      "properties": {
        "ariaLabels": {
          "type": "boolean"
        },
        "keyboardNavigation": {
          "type": "boolean"
        },
        "highContrast": {
          "type": "boolean"
        },
        "screenReader": {
          "type": "boolean"
        },
        "focusManagement": {
          "type": "boolean"
        }
      },
      "additionalProperties": true
    },
    "performance": {
      "type": "object",
      "properties": {
        "enableCaching": {
          "type": "boolean"
        },
        "lazyLoading": {
          "type": "boolean"
        },
        "virtualScrolling": {
          "type": "boolean"
        }
      },
      "additionalProperties": true
    },
    "security": {
      "type": "object",
      "properties": {
        "validatePermissions": {
          "type": "boolean"
        },
        "auditAccess": {
          "type": "boolean"
        },
        "sessionTimeout": {
          "type": "number",
          "minimum": 0
        }
      },
      "additionalProperties": true
    }
  },
  "required": [
    "component",
    "ui",
    "roleBasedAccess",
    "menuStructure",
    "data",
    "responsive",
    "accessibility",
    "performance",
    "security"
  ],
  "additionalProperties": false
}
